{
  "chunk_id": "systems-performance-chapter-2-methodologies-continuation-chunk-0033",
  "content_hash": "edfafe11100c3770787abf1986be9cd0a0f36741226f8005fb1ac8b4c582fe4d",
  "next_chunk_id": "systems-performance-chapter-2-methodologies-tail-chunk-0034",
  "page_end": 120,
  "page_start": 118,
  "prev_chunk_id": "systems-performance-chapter-2-methodologies-continuation-chunk-0032",
  "processed_id": "systems-performance-processed-001",
  "raw_id": "systems-performance-raw-001",
  "review_status": "unreviewed",
  "source_id": "systems-performance",
  "text": "[page 118]\n2.10 Visualizations 79\n\n\n    \u25a0 Weekly: As well as a daily pattern, there may be a weekly pattern present based on work-\n      days and weekends.\n\n    \u25a0 Quarterly: Financial reports are done on a quarterly schedule.\n\n    \u25a0 Yearly: Yearly patterns of load may be due to school schedules and vacations.\n\nIrregular increases in load may occur with other activities, such as releasing new content on a\nwebsite, and sales (Black Friday/Cyber Monday in the US). Irregular decreases in load can occur\ndue to external activities, such as widespread power or internet outages, and sports finals (where\neveryone watches the game instead of using your product).6\n\n\n2.9.2 Monitoring Products\nThere are many third-party products for system performance monitoring. Typical features\ninclude archiving data and presenting it as browser-based interactive graphs, and providing\nconfigurable alerts.\n\nSome of these operate by running agents (also known as exporters) on the system to gather their sta-\ntistics. These agents either execute operating system observability tools (such as iostat(1) or sar(1))\nand parse the text of the output (which is considered inefficient) or read directly from operating\nsystem libraries and kernel interfaces. Monitoring products support a collection of custom agents\nfor exporting statistics from specific targets: web servers, databases, and language runtimes.\n\nAs systems become more distributed and the usage of cloud computing continues to grow, you\nwill more often need to monitor numerous systems: hundreds, thousands, or more. This is\nwhere a centralized monitoring product can be especially useful, allowing an entire environ-\nment to be monitored from one interface.\n\nAs a specific example: the Netflix cloud is composed of over 200,000 instances and is monitored\nusing the Atlas cloud-wide monitoring tool, which was custom built by Netflix to operate at this\nscale and is open source [Harrington 14]. Other monitoring products are discussed in Chapter 4,\nObservability Tools, Section 4.2.4, Monitoring.\n\n\n2.9.3 Summary-Since-Boot\nIf monitoring has not been performed, check whether at least summary-since-boot values are\navailable from the operating system, which can be used to compare with the current values.\n\n\n    2.10 Visualizations\n\n    Visualizations allow more data to be examined than can be easily understood (or sometimes\n    even displayed) as text. They also enable pattern recognition and pattern matching. This can be\n    an effective way to identify correlations between different metric sources, which may be diffi-\n    cult to accomplish programmatically, but easy to do visually.\n\n\n    6 When I was on the Netflix SRE on-call rotation, I learned some non-traditional analysis tools for these cases: to\n    check social media for suspected power outages and to ask in team chatrooms if anyone knew of a sports final.\n\n[page 119]\n80   Chapter 2}}Methodologies\n\n         2.10.1 Line Chart\n         A line chart (also called line graph) is a well-known, basic visualization. It is commonly used for\n         examining performance metrics over time, showing the passage of time on the x-axis.\n\n         Figure 2.27 is an example, showing the average (mean) disk I/O latency for a 20-second period.\n         This was measured on a production cloud server running a MySQL database, where disk I/O\n         latency was suspected to be causing slow queries.\n\n\n\n\n\n\n\n\n\n\nFigure 2.27 Line chart of average latency\n\nThis line chart shows fairly consistent average read latency of around 4 ms, which is higher than\nexpected for these disks.\n\nMultiple lines can be plotted, showing related data on the same set of axes. With this example, a\nseparate line may be plotted for each disk, showing whether they exhibit similar performance.\n\nStatistical values can also be plotted, providing more information on the distribution of data.\nFigure 2.28 shows the same range of disk I/O events, with lines added for the per-second median,\nstandard deviation, and percentiles. Note that the y-axis now has a much greater range than the\nprevious line chart (by a factor of 8).\n\nThis shows why the average is higher than expected: the distribution includes higher-latency\nI/O. Specifically, 1% of the I/O is over 20 ms, as shown by the 99th percentile. The median also\nshows where I/O latency was expected, around 1 ms.\n\n[page 120]\n2.10 Visualizations 81\n\n\n\n\n\n\n\n\n\n\nFigure 2.28   Median, mean, standard deviation, percentiles\n\n2.10.2 Scatter Plots\nFigure 2.29 shows disk I/O events for the same time range as a scatter plot, which enables all data\nto be seen. Each disk I/O is drawn as a point, with its completion time on the x-axis and latency\non the y-axis.\n\n\n\n\n\n\n\n\n\n\nFigure 2.29   Scatter plot\n\nNow the source of the higher-than-expected average latency can be understood fully: there are\nmany disk I/O with latencies of 10 ms, 20 ms, even over 50 ms. The scatter plot has shown all the\ndata, revealing the presence of these outliers.",
  "title": "Systems Performance \u2014 chapter 2 methodologies continuation pages 118-120",
  "token_estimate": 1012
}
