{
  "chunk_id": "systems-performance-chapter-3-operating-systems-continuation-chunk-0042",
  "content_hash": "fc765a401afb302b6ec121d801c6e74057b0faeb93ac38639c1e2da9e2ff4e3a",
  "next_chunk_id": "systems-performance-chapter-3-operating-systems-continuation-chunk-0043",
  "page_end": 145,
  "page_start": 143,
  "prev_chunk_id": "systems-performance-chapter-3-operating-systems-chunk-0041",
  "processed_id": "systems-performance-processed-001",
  "raw_id": "systems-performance-raw-001",
  "review_status": "unreviewed",
  "source_id": "systems-performance",
  "text": "[page 143]\n104 Chapter 3}}Operating Systems\n\n       3.2.8 Virtual Memory\n       Virtual memory is an abstraction of main memory, providing processes and the kernel with their\n       own, almost infinite,12 private view of main memory. It supports multitasking, allowing processes\n       and the kernel to operate on their own private address spaces without worrying about contention.\n       It also supports oversubscription of main memory, allowing the operating system to transparently\n       map virtual memory between main memory and secondary storage (disks) as needed.\n\n       The role of virtual memory is shown in Figure 3.11. Primary memory is main memory (RAM),\n       and secondary memory is the storage devices (disks).\n\n\n\n\n\n\n\n\n\n\nFigure 3.11 Virtual memory address spaces\u00b9\u00b3\n\nVirtual memory is made possible by support in both the processor and operating system. It is not\nreal memory, and most operating systems map virtual memory to real memory only on demand,\nwhen the memory is first populated (written).\n\nSee Chapter 7, Memory, for more about virtual memory.\n\nMemory Management\nWhile virtual memory allows main memory to be extended using secondary storage, the kernel\nstrives to keep the most active data in main memory. There are two kernel schemes for this:\n\n    \u25a0 Process swapping moves entire processes between main memory and secondary storage.\n\n    \u25a0 Paging moves small units of memory called pages (e.g., 4 Kbytes).\n\n12 On 64-bit processors, anyway. For 32-bit processors, virtual memory is limited to 4 Gbytes due to the limits of a\n32-bit address (and the kernel may limit it to an even smaller amount).\n13 Process virtual memory is shown as starting from 0 as a simplification. Kernels today commonly begin a process\u2019s\nvirtual address space at some offset such as 0x10000 or a random address. One benefit is that a common pro-\ngramming error of dereferencing a NULL (0) pointer will then cause the program to crash (SIGSEGV) as the 0 address\nis invalid. This is generally preferable to dereferencing data at address 0 by mistake, as the program would continue\nto run with corrupt data.\n\n[page 144]\n3.2 Background 105\n\n\nProcess swapping is the original Unix method and can cause severe performance loss. Paging is\nmore efficient and was added to BSD with the introduction of paged virtual memory. In both\ncases, least recently used (or not recently used) memory is moved to secondary storage and\nmoved back to main memory only when needed again.\n\nIn Linux, the term swapping is used to refer to paging. The Linux kernel does not support the\n(older) Unix-style process swapping of entire threads and processes.\n\nFor more on paging and swapping, see Chapter 7, Memory.\n\n\n3.2.9 Schedulers\nUnix and its derivatives are time-sharing systems, allowing multiple processes to run at the same\ntime by dividing execution time among them. The scheduling of processes on processors and\nindividual CPUs is performed by the scheduler, a key component of the operating system kernel.\nThe role of the scheduler is pictured in Figure 3.12, which shows that the scheduler operates\non threads (in Linux, tasks), mapping them to CPUs.\n\n\n\n\n\n\n\n\n\n\nFigure 3.12 Kernel scheduler\n\nThe basic intent is to divide CPU time among the active processes and threads, and to maintain\na notion of priority so that more important work can execute sooner. The scheduler keeps track\nof all threads in the ready-to-run state, traditionally on per-priority queues called run queues\n[Bach 86]. Modern kernels may implement these queues per CPU and may also use other data\nstructures, apart from queues, to track the threads. When more threads want to run than there\nare available CPUs, the lower-priority threads wait their turn. Most kernel threads run with a\nhigher priority than user-level processes.\n\nProcess priority can be modified dynamically by the scheduler to improve the performance of\ncertain workloads. Workloads can be categorized as either:\n\n[page 145]\n106 Chapter 3}}Operating Systems\n\n\n    \u25a0 CPU-bound: Applications that perform heavy compute, for example, scientific and math-\n      ematical analysis, which are expected to have long runtimes (seconds, minutes, hours,\n      days, or even longer). These become limited by CPU resources.\n\n    \u25a0 I/O-bound: Applications that perform I/O, with little compute, for example, web servers,\n      file servers, and interactive shells, where low-latency responses are desirable. When their\n      load increases, they are limited by I/O to storage or network resources.\n\nA commonly used scheduling policy dating back to UNIX identifies CPU-bound workloads and\ndecreases their priority, allowing I/O-bound workloads\u2014where low-latency responses are more\ndesirable\u2014to run sooner. This can be achieved by calculating the ratio of recent compute time\n(time executing on-CPU) to real time (elapsed time) and decreasing the priority of processes with\na high (compute) ratio [Thompson 78]. This mechanism gives preference to shorter-running\nprocesses, which are usually those performing I/O, including human interactive processes.\n\nModern kernels support multiple scheduling classes or scheduling policies (Linux) that apply different\nalgorithms for managing priority and runnable threads. These may include real-time scheduling,\nwhich uses a priority higher than all noncritical work, including kernel threads. Along with\npreemption support (described later), real-time scheduling provides predictable and low-latency\nscheduling for systems that require it.\n\nSee Chapter 6, CPUs, for more about the kernel scheduler and other scheduling algorithms.\n\n\n3.2.10 File Systems\nFile systems are an organization of data as files and directories. They have a file-based interface\nfor accessing them, usually based on the POSIX standard. Kernels support multiple file system\ntypes and instances. Providing a file system is one of the most important roles of the operating\nsystem, once described as the most important role [Ritchie 74].\n\nThe operating system provides a global file namespace, organized as a top-down tree topology\nstarting with the root level (\u201c/\u201d). File systems join the tree by mounting, attaching their own tree\nto a directory (the mount point). This allows the end user to navigate the file namespace transpar-\nently, regardless of the underlying file system type.\n\nA typical operating system may be organized as shown in Figure 3.13.\n\n\n\n\n\n\n\n\n\n\n        Figure 3.13 Operating system file hierarchy",
  "title": "Systems Performance \u2014 chapter 3 operating systems continuation pages 143-145",
  "token_estimate": 1293
}
