{
  "chunk_id": "systems-performance-chapter-4-observability-tools-continuation-chunk-0062",
  "content_hash": "f9d6cd133611971c5e1285480a4ecf39fcb234d6117d00d772ba2b083525f48b",
  "next_chunk_id": "systems-performance-chapter-4-observability-tools-tail-chunk-0063",
  "page_end": 197,
  "page_start": 196,
  "prev_chunk_id": "systems-performance-chapter-4-observability-tools-continuation-chunk-0061",
  "processed_id": "systems-performance-processed-001",
  "raw_id": "systems-performance-raw-001",
  "review_status": "unreviewed",
  "source_id": "systems-performance",
  "text": "[page 196]\n4.3 Observability Sources 157\n\n\n    Event Name                   UMask   Event   Example Event Mask Mnemonic\n                                         Select\n    LLC Misses                   41H     2EH     LONGEST_LAT_CACHE.MISS\n    Branch Instruction Retired   00H     C4H     BR_INST_RETIRED.ALL_BRANCHES\n    Branch Misses Retired        00H     C5H     BR_MISP_RETIRED.ALL_BRANCHES\n\n\n    As an example of PMCs, if you run the perf stat command without specifying events (no -e),\n    it defaults to instrumenting the architectural PMCs. For example, the following runs perf  stat\n    on the gzip(1) command:\n\n    # perf  stat gzip words\n\n    Performance counter  stats for   'gzip words':\n\n             156.927428    task-clock  (msec)     #   0.987 CPUs        utilized\n                      1    context-switches       #   0.006 K/sec\n                      0    cpu-migrations         #   0.000 K/sec\n                    131    page-faults            #   0.835 K/sec\n            209,911,358    cycles                 #   1.338 GHz\n            288,321,441    instructions           #   1.37          insn per cycle\n             66,240,624    branches               #  422.110        M/sec\n              1,382,627    branch-misses          #   2.09% of all          branches\n\n            0.159065542 seconds   time elapsed\n\nThe raw counts are the first column; after a hash are some statistics, including an important\nperformance metric: instructions per cycle (insn per cycle). This shows how efficiently the CPUs\nare executing instructions\u2014the higher, the better. This metric is explained in the Chapter 6,\nCPUs, Section 6.3.7, IPC, CPI.\n\n    PMC Interface\n    On Linux PMCs are accessed via the perf_event_open(2) syscall and are consumed by tools\n    including perf(1).\n\n    While there are hundreds of PMCs available, there is only a fixed number of registers available\n    in the CPUs to measure them at the same time, perhaps as few as six. You need to choose which\n    PMCs you\u2019d like to measure on those six registers, or cycle through different PMC sets as a way\n    of sampling them (Linux perf(1) supports this automatically). Other software counters do not\n    suffer from these constraints.\n\n    PMCs can be used in different modes: counting, where they count events with practically zero\n    overhead; and overflow sampling, where an interrupt is raised for one in every configurable\n    number of events, so that state can be captured. Counting can be used to quantify problems;\n    overflow sampling can be used to show the code path responsible.\n\n[page 197]\n158 Chapter 4}}Observability Tools\n\n\nperf(1) can perform counting using the stat subcommand, and sampling using the record sub-\ncommand; see Chapter 13, perf.\n\nPMC Challenges\nTwo common challenges when using PMCs are their accuracy for overflow sampling and their\navailability in cloud environments.\n\nOverflow sampling may not record the correct instruction pointer that triggered the event, due\nto interrupt latency (often called \u201cskid\u201d) or out-of-order instruction execution. For CPU cycle\nprofiling, such skid may not be a problem, and some profilers deliberately introduce jitter to\navoid lockstep sampling (or use an offset sampling rate such as 99 Hertz). But for measuring\nother events, such as LLC misses, the sampled instruction pointer needs to be accurate.\n\nThe solution is processor support for what are known as precise events. On Intel, precise events\nuse a technology called precise event-based sampling (PEBS),9 which uses hardware buffers to\nrecord a more accurate (\u201cprecise\u201d) instruction pointer at the time of the PMC event. On AMD,\nprecise events use instruction-based sampling (IBS) [Drongowski 07]. The Linux perf(1) com-\nmand supports precise events (see Chapter 13, perf, Section 13.9.2, CPU Profiling).\n\nAnother challenge is cloud computing, as many cloud environments disable PMC access for\ntheir guests. It is technically possible to enable it: for example, the Xen hypervisor has the vpmu\ncommand line option, which allows different sets of PMCs to be exposed to guests10 [Xenbits 20].\nAmazon have enabled many PMCs for their Nitro hypervisor guests.11 Also, some cloud providers\noffer \u201cbare-metal instances\u201d where the guest has full processor access, and therefore full PMC access.\n\nPMCs Documentation\nPMCs are processor-specific and documented in the appropriate processor software developer\u2019s\nmanual. Examples by processor manufacturer:\n\n    \u25a0 Intel: Chapter 19, \u201cPerformance Monitoring Events,\u201d of Intel\u00ae 64 and IA-32 Architectures\n      Software Developer\u2019s Manual Volume 3 [Intel 16].\n\n    \u25a0 AMD: Section 2.1.1, \u201cPerformance Monitor Counters,\u201d of Open-Source Register Reference For\n      AMD Family 17h Processors Models 00h-2Fh [AMD 18]\n\n    \u25a0 ARM: Section D7.10, \u201cPMU Events and Event Numbers,\u201d of Arm\u00ae Architecture Reference\n      Manual Armv8, for Armv8-A architecture profile [ARM 19]\n\nThere has been work to develop a standard naming scheme for PMCs that could be supported\nacross all processors, called the performance application programming interface (PAPI) [UTK 20].\nOperating system support for PAPI has been mixed: it requires frequent updates to map PAPI\nnames to vendor PMC codes.\n\nChapter 6, CPUs, Section 6.4.1, Hardware, subsection Hardware Counters (PMCs), describes their\nimplementation in more detail and provides additional PMC examples.\n\n9 Some of Intel\u2019s documentation expands PEBS differently, as: processor event-based sampling.\n10 I wrote the Xen code that allows different PMC modes: \u201cipc\u201d for instructions-per-cycle PMCs only, and \u201carch\u201d for\nthe Intel architectural set. My code was just a firewall on the existing vpmu support in Xen.\n11 Currently only for larger Nitro instances where the VM owns a full processor socket (or more).",
  "title": "Systems Performance \u2014 chapter 4 observability tools continuation pages 196-197",
  "token_estimate": 1054
}
