{
  "chunk_id": "systems-performance-chapter-4-observability-tools-tail-chunk-0065",
  "content_hash": "d0065bba831dec170fa0005c81c29e9dd8a78403447981d0f2cce08758845cae",
  "next_chunk_id": "systems-performance-chapter-4-observability-tools-tail-chunk-0066",
  "page_end": 207,
  "page_start": 205,
  "prev_chunk_id": "systems-performance-chapter-4-observability-tools-tail-chunk-0064",
  "processed_id": "systems-performance-processed-001",
  "raw_id": "systems-performance-raw-001",
  "review_status": "unreviewed",
  "source_id": "systems-performance",
  "text": "[page 205]\n166 Chapter 4}}Observability Tools\n\n\n         passive/s\n               The  number  of times TCP  connections have  made a    direct\n               transition   to     the SYN-RCVD state from  the LISTEN state\n               per  second  [tcpPassiveOpens].\n\n         iseg/s\n               The  total number   of segments received per second,  includ-\n               ing  those   received     in error [tcpInSegs].    This count\n               includes segments received on currently     established  con-\n               nections.\n    [...]\n\n    Specific uses of sar(1) are described later in this book; see Chapters 6 to 10. Appendix C is a sum-\n    mary of the sar(1) options and metrics.\n\n\n4.5 Tracing Tools\n\nLinux tracing tools use the previously described events interfaces (tracepoints, kprobes, uprobes,\nUSDT) for advanced performance analysis. The main tracing tools are:\n\n    \u25a0 perf(1): The official Linux profiler. It is excellent for CPU profiling (sampling of stack\n      traces) and PMC analysis, and can instrument other events, typically recording to an\n      output file for post-processing.\n\n    \u25a0 Ftrace: The official Linux tracer, it is a multi-tool composed of different tracing utilities. It\n      is suited for kernel code path analysis and resource-constrained systems, as it can be used\n      without dependencies.\n\n    \u25a0 BPF (BCC, bpftrace): Extended BPF was introduced in Chapter 3, Operating Systems,\n      Section 3.4.4, Extended BPF. It powers advanced tracing tools, the main ones being BCC\n      and bpftrace. BCC provides powerful tools, and bpftrace provides a high-level language\n      for custom one-liners and short programs.\n\n    \u25a0 SystemTap: A high-level language and tracer with many tapsets (libraries) for tracing\n      different targets [Eigler 05][Sourceware 20]. It has recently been developing a BPF backend,\n      which I recommend (see the stapbpf(8) man page).\n\n    \u25a0 LTTng: A tracer optimized for black-box recording: optimally recording many events for\n      later analysis [LTTng 20].\n\nThe first three tracers are covered in Chapter 13, perf; Chapter 14, Ftrace; and Chapter 15, BPF. The\nchapters that now follow (5 to 12) include various uses of these tracers, showing the commands\nto type and how to interpret the output. This ordering is deliberate, focusing on uses and perfor-\nmance wins first, and then covering the tracers in more detail later if and as needed.\n\nAt Netflix, I use perf(1) for CPU analysis, Ftrace for kernel code digging, and BCC/bpftrace for\neverything else (memory, file systems, disks, networking, and application tracing).\n\n[page 206]\n4.6     Observing Observability     167\n\n    4.6     Observing Observability\n\n    Observability tools and the statistics upon which they are built are implemented in software,\n    and all software has the potential for bugs. The same is true for the documentation that describes\n    the software. Regard with a healthy skepticism any statistics that are new to you, questioning\n    what they really mean and whether they are really correct.\n\n    Metrics may be subject to any of the following problems:\n\n     \u25a0  Tools and measurements are sometimes wrong.\n\n     \u25a0  Man pages are not always right.\n\n     \u25a0  Available metrics may be incomplete.\n\n     \u25a0  Available metrics may be poorly designed and confusing.\n\n     \u25a0  Metric collectors (e.g., that parse tool output) can have bugs.13\n\n     \u25a0  Metric processing (algorithms/spreadsheets) can also introduce errors.\n\n    When multiple observability tools have overlapping coverage, you can use them to cross-check\n    each other. Ideally, they will source different instrumentation frameworks to check for bugs in\n    the frameworks as well. Dynamic instrumentation is especially useful for this purpose, as custom\n    tools can be created to double-check metrics.\n\n    Another verification technique is to apply known workloads and then to check that the observ-\n    ability tools agree with the results you expect. This can involve the use of micro-benchmarking\n    tools that report their own statistics for comparison.\n\n    Sometimes it isn\u2019t the tool or statistic that is in error, but the documentation that describes\n    it, including man pages. The software may have evolved without the documentation being\n    updated.\n\n    Realistically, you may not have time to double-check every performance measurement you use\n    and will do this only if you encounter unusual results or a result that is company critical. Even\n    if you do not double-check, it can be valuable to be aware that you didn\u2019t and that you assumed\n    the tools were correct.\n\n    Metrics can also be incomplete. When faced with a large number of tools and metrics, it may\n    be tempting to assume that they provide complete and effective coverage. This is often not the\n    case: metrics may have been added by programmers to debug their own code, and later built into\n    observability tools without much study of real customer needs. Some programmers may not\n    have added any at all to new subsystems.\n\n\n\n13 In this case the tool and measurement are correct, but an automated collector has introduced errors. At Surge 2013\nI gave a lightning talk on an astonishing case [Gregg 13c]: a benchmarking company reported poor metrics for a prod-\nuct I was supporting, and I dug in. It turned out the shell script they used to automate the benchmark had two bugs.\nFirst, when processing output from fio(1), it would take a result such as \u201c100KB/s\u201d and use a regular expression\nto elide nun-numeric characters, including \u201cKB/s\u201d to turn this into \u201c100\u201d. Since fio(1) reported results with different\nunits (bytes, Kbytes, Mbytes), this introduced massive (1024x) errors. Second, they also elided decimal places, so a\nresult of \u201c1.6\u201d became \u201c16\u201d.\n\n[page 207]\n168 Chapter 4}}Observability Tools\n\n\nAn absence of metrics can be more difficult to identify than the presence of poor metrics.\nChapter 2, Methodologies, can help you find these missing metrics by studying the questions\nyou need answered for performance analysis.\n\n\n    4.7     Exercises\n\n    Answer the following questions about observability tools (you may wish to revisit the introduc-\n    tion to some of these terms in Chapter 1):\n\n     1.  List some static performance tools.\n\n     2.  What is profiling?\n\n     3.  Why would profilers use 99 Hertz instead of 100 Hertz?\n\n     4.  What is tracing?\n\n     5.  What is static instrumentation?\n\n     6.  Describe why dynamic instrumentation is important.\n\n     7.  What is the difference between tracepoints and kprobes?\n\n     8.  Describe the expected CPU overhead (low/medium/high) from the following:\n\n         \u25a0  Disk IOPS counters (as seen by iostat(1))\n\n         \u25a0  Tracing per-event disk I/O via tracepoints or kprobes\n\n         \u25a0  Tracing per-event context switches (tracepoints/kprobes)\n\n         \u25a0  Tracing per-event process execution (execve(2)) (tracepoints/kprobes)\n\n         \u25a0  Tracing per-event libc malloc() via uprobes\n\n     9.  Describe why PMCs are valuable for performance analysis.\n\n    10.  Given an observability tool, describe how you could determine what instrumentation\n         sources it uses.\n\n\n4.8 References\n\n   [Eigler 05] Eigler, F. Ch., et al. \u201cArchitecture of SystemTap: A Linux Trace/Probe Tool,\u201d\n   http://sourceware.org/systemtap/archpaper.pdf, 2005.\n\n   [Drongowski 07] Drongowski, P., \u201cInstruction-Based Sampling: A New Performance\n   Analysis Technique for AMD Family 10h Processors,\u201d AMD (Whitepaper), 2007.\n\n   [Ayuso 12] Ayuso, P., \u201cThe Conntrack-Tools User Manual,\u201d http://conntrack-tools.netfilter.org/\n   manual.html, 2012.\n\n   [Gregg 13c] Gregg, B., \u201cBenchmarking Gone Wrong,\u201d Surge 2013: Lightning Talks,\n   https://www.youtube.com/watch?v=vm1GJMp0QN4#t=17m48s, 2013.",
  "title": "Systems Performance \u2014 chapter 4 observability tools tail pages 205-207",
  "token_estimate": 1444
}
