{
  "chunk_id": "systems-performance-chapter-3-operating-systems-continuation-chunk-0047",
  "content_hash": "6d8ff7afd2ce0f9daed47401352e0d631f814ff99290081c488e7a2eea419d2e",
  "next_chunk_id": "systems-performance-chapter-3-operating-systems-continuation-chunk-0048",
  "page_end": 156,
  "page_start": 155,
  "prev_chunk_id": "systems-performance-chapter-3-operating-systems-continuation-chunk-0046",
  "processed_id": "systems-performance-processed-001",
  "raw_id": "systems-performance-raw-001",
  "review_status": "unreviewed",
  "source_id": "systems-performance",
  "text": "[page 155]\n116 Chapter 3}}Operating Systems\n\n\n\u25a0 Modular I/O scheduling (2.6.10): Linux provides pluggable scheduling algorithms for\n  scheduling block device I/O. See Chapter 9, Disks.\n\n\u25a0 DebugFS (2.6.11): A simple unstructured interface for the kernel to expose data to user\n  level, which is used by some performance tools.\n\n\u25a0 Cpusets (2.6.12): exclusive CPU grouping for processes.\n\n\u25a0 Voluntary kernel preemption (2.6.13): This process provides low-latency scheduling\n  without the complexity of full preemption.\n\n\u25a0 inotify (2.6.13): A framework for monitoring file system events.\n\n\u25a0 blktrace (2.6.17): A framework and tool for tracing block I/O events (later migrated into\n  tracepoints).\n\n\u25a0 splice (2.6.17): A system call to move data quickly between file descriptors and pipes,\n  without a trip through user-space. (The sendfile(2) syscall, which efficiently moves data\n  between file descriptors, is now a wrapper to splice(2).)\n\n\u25a0 Delay accounting (2.6.18): Tracks per-task delay states. See Chapter 4, Observability Tools.\n\n\u25a0 IO accounting (2.6.20): Measures various storage I/O statistics per process.\n\n\u25a0 DynTicks (2.6.21): Dynamic ticks allow the kernel timer interrupt (clock) to not fire\n  during idle, saving CPU resources and power.\n\n\u25a0 SLUB (2.6.22): A new and simplified version of the slab memory allocator.\n\n\u25a0 CFS (2.6.23): Completely fair scheduler. See Chapter 6, CPUs.\n\n\u25a0 cgroups (2.6.24): Control groups allow resource usage to be measured and limited for\n  groups of processes.\n\n\u25a0 TCP LRO (2.6.24): TCP Large Receive Offload (LRO) allows network drivers and hardware\n  to aggregate packets into larger sizes before sending them to the network stack. Linux also\n  supports Large Send Offload (LSO) for the send path.\n\n\u25a0 latencytop (2.6.25): Instrumentation and a tool for observing sources of latency in the\n  operating system.\n\n\u25a0 Tracepoints (2.6.28): Static kernel tracepoints (aka static probes) that instrument logical\n  execution points in the kernel, for use by tracing tools (previously called kernel markers).\n  Tracing tools are introduced in Chapter 4, Observability Tools.\n\n\u25a0 perf (2.6.31): Linux Performance Events (perf) is a set of tools for performance observabil-\n  ity, including CPU performance counter profiling and static and dynamic tracing. See\n  Chapter 6, CPUs, for an introduction.\n\n\u25a0 No BKL (2.6.37): Final removal of the big kernel lock (BKL) performance bottleneck.\n\n\u25a0 Transparent huge pages (2.6.38): This is a framework to allow easy use of huge (large)\n  memory pages. See Chapter 7, Memory.\n\n\u25a0 KVM: The Kernel-based Virtual Machine (KVM) technology was developed for Linux by\n  Qumranet, which was purchased by Red Hat in 2008. KVM allows virtual operating sys-\n  tem instances to be created, running their own kernel. See Chapter 11, Cloud Computing.\n\n[page 156]\n3.4 Linux 117\n\n\n\u25a0 BPF JIT (3.0): A Just-In-Time (JIT) compiler for the Berkeley Packet Filter (BPF) to improve\n  packet filtering performance by compiling BPF bytecode to native instructions.\n\n\u25a0 CFS bandwidth control (3.2): A CPU scheduling algorithm that supports CPU quotas and\n  throttling.\n\n\u25a0 TCP anti-bufferbloat (3.3+): Various enhancements were made from Linux 3.3 onwards\n  to combat the bufferbloat problem, including Byte Queue Limits (BQL) for the transmis-\n  sion of packet data (3.3), CoDel queue management (3.5), TCP small queues (3.6), and the\n  Proportional Integral controller Enhanced (PIE) packet scheduler (3.14).\n\n\u25a0 uprobes (3.5): The infrastructure for dynamic tracing of user-level software, used by other\n  tools (perf, SystemTap, etc.).\n\n\u25a0 TCP early retransmit (3.5): RFC 5827 for reducing duplicate acknowledgments required\n  to trigger fast retransmit.\n\n\u25a0 TFO (3.6, 3.7, 3.13): TCP Fast Open (TFO) can reduce the TCP three-way handshake to a\n  single SYN packet with a TFO cookie, improving performance. It was made the default in\n  3.13.\n\n\u25a0 NUMA balancing (3.8+): This added ways for the kernel to automatically balance memory\n  locations on multi-NUMA systems, reducing CPU interconnect traffic and improving\n  performance.\n\n\u25a0 SO_REUSEPORT (3.9): A socket option to allow multiple listener sockets to bind to the\n  same port, improving multi-threaded scalability.\n\n\u25a0 SSD cache devices (3.9): Device mapper support for an SSD device to be used as a cache for\n  a slower rotating disk.\n\n\u25a0 bcache (3.10): An SSD cache technology for the block interface.\n\n\u25a0 TCP TLP (3.10): TCP Tail Loss Probe (TLP) is a scheme to avoid costly timer-based retransmits\n  by sending new data or the last unacknowledged segment after a shorter probe timeout, to\n  trigger faster recovery.\n\n\u25a0 NO_HZ_FULL (3.10, 3.12): Also known as timerless multitasking or a tickless kernel, this\n  allows non-idle threads to run without clock ticks, avoiding workload perturbations\n  [Corbet 13a].\n\n\u25a0 Multiqueue block I/O (3.13): This provides per-CPU I/O submission queues rather than\n  a single request queue, improving scalability especially for high IOPS SSD devices [Corbet\n  13b].\n\n\u25a0 SCHED_DEADLINE (3.14): An optional scheduling policy that implements earliest deadline\n  first (EDF) scheduling [Linux 20b].\n\n\u25a0 TCP autocorking (3.14): This allows the kernel to coalesce small writes, reducing the sent\n  packets. An automatic version of the TCP_CORK setsockopt(2).\n\n\u25a0 MCS locks and qspinlocks (3.15): Efficient kernel locks, using techniques such as per-\n  CPU structures. MCS is named after the original lock inventors (Mellor-Crummey and\n  Scott) [Mellor-Crummey 91][Corbet 14].",
  "title": "Systems Performance \u2014 chapter 3 operating systems continuation pages 155-156",
  "token_estimate": 1080
}
