{
  "chunk_id": "systems-performance-chapter-2-methodologies-tail-chunk-0034",
  "content_hash": "04db83c2868b51aef76e381fbf4bb3ab7e9b2e110c47d165c5077f24922e67aa",
  "next_chunk_id": "systems-performance-chapter-2-methodologies-tail-chunk-0035",
  "page_end": 124,
  "page_start": 121,
  "prev_chunk_id": "systems-performance-chapter-2-methodologies-continuation-chunk-0033",
  "processed_id": "systems-performance-processed-001",
  "raw_id": "systems-performance-raw-001",
  "review_status": "unreviewed",
  "source_id": "systems-performance",
  "text": "[page 121]\n82 Chapter 2}}Methodologies\n\n\nMany of the I/O were submillisecond, shown close to the x-axis. This is where the resolution of\nscatter plots begins to become a problem, as the points overlap and become difficult to distin-\nguish. This gets worse with more data: imagine plotting events from an entire cloud, involving\nmillions of data points, on one scatter plot: the dots can merge and become a \u201cwall of paint.\u201d\nAnother problem is the volume of data that must be collected and processed: x and y coordinates\nfor every I/O.\n\n\n2.10.3 Heat Maps\nHeat maps (more properly called a column quantization) can solve the scatter plot scalability prob-\nlems by quantizing x and y ranges into groups called buckets. These are displayed as large pixels,\ncolored based on the number of events in that x and y range. This quantizing also solves the\nscatter plot visual density limit, allowing heat maps to show data from a single system or thou-\nsands of systems in the same way. Heat maps had previously been used for location such as disk\noffsets (e.g., TazTool [McDougall 06a]); I invented their use in computing for latency, utilization,\nand other metrics. Latency heat maps were first included in Analytics for the Sun Microsystems\nZFS Storage appliance, released in 2008 [Gregg 10a][Gregg 10b], and are now commonplace in\nperformance monitoring products such as Grafana [Grafana 20].\n\nThe same dataset as plotted earlier is shown in Figure 2.30 as a heat map.\n\n\n\n\n\n\n\n\n\n\n    Figure 2.30 Heat map\n\n    High-latency outliers can be identified as blocks that are high in the heat map, usually of light\n    colors as they span few I/O (often a single I/O). Patterns in the bulk of the data begin to emerge,\n    which may be impossible to see with a scatter plot.\n\n    The full range of seconds for this disk I/O trace (not shown earlier) is shown in the Figure 2.31\n    heat map.\n\n[page 122]\n2.10 Visualizations 83\n\n\n\n\n\n\n\n\n\n\nFigure 2.31 Heat map: full range\n\nDespite spanning nine times the range, the visualization is still very readable. A bimodal distri-\nbution can be seen for much of the range, with some I/O returning with near-zero latency (likely\na disk cache hit), and others with a little less than 1 ms (likely a disk cache miss).\n\nThere are other examples of heat maps later in this book, including in Chapter 6, CPUs, Section 6.7,\nVisualizations; Chapter 8, File Systems, Section 8.6.18, Visualizations; and Chapter 9, Disks,\nSection 9.7.3, Latency Heat Maps. My website also has examples of latency, utilization, and\nsubsecond-offset heat maps [Gregg 15b].\n\n\n2.10.4 Timeline Charts\nA timeline chart shows a set of activities as bars on a timeline. These are commonly used for\nfront-end performance analysis (web browsers), where they are also called waterfall charts, and\nshow the timing of network requests. An example from the Firefox web browser is shown in\nFigure 2.32.\n\nIn Figure 2.32, the first network request is highlighted: apart from showing its duration as a hor-\nizontal bar, components of this duration are also shown as colored bars. These are also explained\nin the right panel: the slowest component for the first request is \u201cWaiting,\u201d which is waiting\nfor the HTTP response from the server. Requests two to six begin after the first request begins\nreceiving data, and are likely dependent on that data. If explicit dependency arrows are included\nin the chart, it becomes a type of Gantt chart.\n\nFor back-end performance analysis (servers), similar charts are used to show timelines for\nthreads or CPUs. Example software includes KernelShark [KernelShark 20] and Trace Compass\n[Eclipse 20]. For an example KernelShark screenshot, see Chapter 14, Ftrace, Section 14.11.5,\nKernelShark. Trace Compass also draws arrows showing dependencies, where one thread has\nwoken up another.\n\n[page 123]\n84 Chapter 2}}Methodologies\n\n\n\n\n\n\n\n\n\n\nFigure 2.32 Firefox timeline chart\n\n2.10.5 Surface Plot\nThis is a representation of three dimensions, rendered as a three-dimensional surface. It works\nbest when the third-dimension value does not frequently change dramatically from one point\nto the next, producing a surface resembling rolling hills. A surface plot is often rendered as a\nwireframe model.\n\nFigure 2.33 shows a wireframe surface plot of per-CPU utilization. It contains 60 seconds of\nper-second values from many servers (this is cropped from an image that spanned a data center\nof over 300 physical servers and 5,312 CPUs) [Gregg 11b].\n\nEach server is represented by plotting its 16 CPUs as rows on the surface, the 60 per-second uti-\nlization measurements as columns, and then setting the height of the surface to the utilization\nvalue. Color is also set to reflect the utilization value. Both hue and saturation could be used, if\ndesired, to add fourth and fifth dimensions of data to the visualization. (With sufficient resolu-\ntion, a pattern could be used to indicate a sixth dimension.)\n\nThese 16 \u00d7 60 server rectangles are then mapped across the surface as a checkerboard. Even\nwithout markings, some server rectangles can be clearly seen in the image. One that appears as\nan elevated plateau on the right shows that its CPUs are almost always at 100%.\n\nThe use of grid lines highlights subtle changes in elevation. Some faint lines are visible, which\nindicate a single CPU constantly running at low utilization (a few percent).\n\n[page 124]\n2.11 Exercises 85\n\n\n\n\n\n\n\n\n\n\nFigure 2.33 Wireframe surface plot: data center CPU utilization\n\n2.10.6 Visualization Tools\nUnix performance analysis has historically focused on the use of text-based tools, due in part\nto limited graphical support. Such tools can be executed quickly over a login session and report\ndata in real time. Visualizations have been more time-consuming to access and often require a\ntrace-and-report cycle. When working urgent performance issues, the speed at which you can\naccess metrics can be critical.\n\nModern visualization tools provide real-time views of system performance, accessible from the\nbrowser and mobile devices. There are numerous products that do this, including many that\ncan monitor your entire cloud. Chapter 1, Introduction, Section 1.7.1, Counters, Statistics, and\nMetrics, includes an example screenshot from one such product, Grafana, and other monitoring\nproducts are discussed in Chapter 4, Observability Tools, Section 4.2.4, Monitoring.\n\n\n    2.11   Exercises\n\n    1.  Answer the following questions about key performance terminology:\n\n        \u25a0  What are IOPS?\n\n        \u25a0  What is utilization?\n\n        \u25a0  What is saturation?\n\n        \u25a0  What is latency?\n\n        \u25a0  What is micro-benchmarking?",
  "title": "Systems Performance \u2014 chapter 2 methodologies tail pages 121-124",
  "token_estimate": 1385
}
