{
  "chunk_id": "systems-performance-chapter-3-operating-systems-continuation-chunk-0050",
  "content_hash": "7e8127b091292b2d7a5f761e3aa405c9c8b6b21396f20ddb0996ddfe7014a17c",
  "next_chunk_id": "systems-performance-chapter-3-operating-systems-continuation-chunk-0051",
  "page_end": 162,
  "page_start": 161,
  "prev_chunk_id": "systems-performance-chapter-3-operating-systems-continuation-chunk-0049",
  "processed_id": "systems-performance-processed-001",
  "raw_id": "systems-performance-raw-001",
  "review_status": "unreviewed",
  "source_id": "systems-performance",
  "text": "[page 161]\n122 Chapter 3}}Operating Systems\n\n\nBPF bytecode must first pass through a verifier that checks for safety, ensuring that the BPF\nprogram will not crash or corrupt the kernel. It may also use a BPF Type Format (BTF) system for\nunderstanding data types and structures. BPF programs can output data via a perf ring buffer, an\nefficient way to emit per-event data, or via maps, which are suited for statistics.\n\nBecause it is powering a new generation of efficient, safe, and advanced tracing tools, BPF is\nimportant for systems performance analysis. It provides programmability to existing kernel\nevent sources: tracepoints, kprobes, uprobes, and perf_events. A BPF program can, for example,\nrecord a timestamp on the start and end of I/O to time its duration, and record this in a custom\nhistogram. This book contains many BPF-based programs using the BCC and bpftrace front-\nends. These front-ends are covered in Chapter 15.\n\n\n3.5 Other Topics\n\nSome additional kernel and operating system topics worth summarizing are PGO kernels,\nUnikernels, microkernels, hybrid kernels, and distributed operating systems.\n\n\n3.5.1 PGO Kernels\nProfile-guided optimization (PGO), also known as feedback-directed optimization (FDO), uses\nCPU profile information to improve compiler decisions [Yuan 14a]. This can be applied to kernel\nbuilds, where the procedure is:\n\n   1. While in production, take a CPU profile.\n\n   2. Recompile the kernel based on that CPU profile.\n\n   3. Deploy the new kernel in production.\n\nThis creates a kernel with improved performance for a specific workload. Runtimes such as the\nJVM do this automatically, recompiling Java methods based on their runtime performance, in\nconjunction with just-in-time (JIT) compilation. The process for creating a PGO kernel instead\ninvolves manual steps.\n\nA related compile optimization is link-time optimization (LTO), where an entire binary is com-\npiled at once to allow optimizations across the entire program. The Microsoft Windows kernel\nmakes heavy use of both LTO and PGO, seeing 5 to 20% improvements from PGO [Bearman 20].\nGoogle also use LTO and PGO kernels to improve performance [Tolvanen 20].\n\nThe gcc and clang compilers, and the Linux kernel, all have support for PGO. Kernel PGO\ntypically involves running a specially instrumented kernel to collect profile data. Google has\nreleased an AutoFDO tool that bypasses the need for such a special kernel: AutoFDO allows a\nprofile to be collected from a normal kernel using perf(1), which is then converted to the correct\nformat for compilers to use [Google 20a].\n\nThe only recent documentation on building a Linux kernel with PGO or AutoFDO is two talks\nfrom Linux Plumber\u2019s Conference 2020 by Microsoft [Bearman 20] and Google [Tolvanen 20].15\n\n\n    15 For a while the most recent documentation was from 2014 for Linux 3.13 [Yuan 14b], hindering adoption on newer\n    kernels.\n\n[page 162]\n3.5 Other Topics 123\n\n3.5.2 Unikernels\nA unikernel is a single-application machine image that combines kernel, library, and application\nsoftware together, and can typically run this in a single address space in either a hardware VM\nor on bare metal. This potentially has performance and security benefits: less instruction text\nmeans higher CPU cache hit ratios and fewer security vulnerabilities. This also creates a prob-\nlem: there may be no SSH, shells, or performance tools available for you to log in and debug the\nsystem, nor any way to add them.\n\nFor unikernels to be performance tuned in production, new performance tooling and metrics\nmust be built to support them. As a proof of concept, I built a rudimentary CPU profiler that\nran from Xen dom0 to profile a domU unikernel guest and then built a CPU flame graph, just to\nshow that it was possible [Gregg 16a].\n\nExamples of unikernels include MirageOS [MirageOS 20].\n\n\n3.5.3 Microkernels and Hybrid Kernels\nMost of this chapter discusses Unix-like kernels, also described as monolithic kernels, where all\nthe code that manages devices runs together as a single large kernel program. For the microkernel\nmodel, kernel software is kept to a minimum. A microkernel supports essentials such as memory\nmanagement, thread management, and inter-process communication (IPC). File systems, the\nnetwork stack, and drivers are implemented as user-mode software, which allows those user-\nmode components to be more easily modified and replaced. Imagine not only choosing which\ndatabase or web server to install, but also choosing which network stack to install. The micro-\nkernel is also more fault-tolerant: a crash in a driver does not crash the entire kernel. Examples\nof microkernels include QNX and Minix 3.\n\nA disadvantage with microkernels is that there are additional IPC steps for performing I/O\nand other functions, reducing performance. One solution for this is hybrid kernels, which com-\nbine the benefits of microkernels and monolithic kernels. Hybrid kernels move performance-\ncritical services back into kernel space (with direct function calls instead of IPC) as they are\nwith a monolithic kernel, but retains the modular design and fault tolerance of a micro kernel.\nExamples of hybrid kernels include the Windows NT kernel and the Plan 9 kernel.\n\n\n3.5.4 Distributed Operating Systems\nA distributed operating system runs a single operating system instance across a set of separate\ncomputer nodes, networked together. A microkernel is commonly used on each of the nodes.\nExamples of distributed operating systems include Plan 9 from Bell Labs, and the Inferno operat-\ning system.\n\nWhile an innovative design, this model has not seen widespread use. Rob Pike, co-creator of\nPlan 9 and Inferno, has described various reasons for this, including [Pike 00]:\n\n     \u201cThere was a claim in the late 1970s and early 1980s that Unix had killed operating\n     systems research because no one would try anything else. At the time, I didn\u2019t believe\n     it. Today, I grudgingly accept that the claim may be true (Microsoft notwithstanding).\u201d",
  "title": "Systems Performance \u2014 chapter 3 operating systems continuation pages 161-162",
  "token_estimate": 1250
}
