{
  "chunk_id": "systems-performance-chapter-1-introduction-chunk-0004",
  "content_hash": "32a8591929587a64964538774756be2c9a7c6d562d22ade4d281652fd5e88cf2",
  "next_chunk_id": "systems-performance-chapter-1-introduction-chunk-0005",
  "page_end": 49,
  "page_start": 47,
  "prev_chunk_id": "systems-performance-chapter-1-introduction-chunk-0003",
  "processed_id": "systems-performance-processed-001",
  "raw_id": "systems-performance-raw-001",
  "review_status": "unreviewed",
  "source_id": "systems-performance",
  "text": "[page 47]\n8 Chapter 1}}Introduction\n\n\nIn this section I\u2019ll introduce counters, metrics, profiling, and tracing. I\u2019ll explain observabil-\nity in more detail in Chapter 4, covering system-wide versus per-process observability, Linux\nobservability tools, and their internals. Chapters 5 to 11 include chapter-specific sections on\nobservability, for example, Section 6.6 for CPU observability tools.\n\n\n    1.7.1  Counters, Statistics, and Metrics\n    Applications and the kernel typically provide data on their state and activity: operation counts,\n    byte counts, latency measurements, resource utilization, and error rates. They are typically\n    implemented as integer variables called counters that are hard-coded in the software, some of\n    which are cumulative and always increment. These cumulative counters can be read at different\n    times by performance tools for calculating statistics: the rate of change over time, the average,\n    percentiles, etc.\n\n    For example, the vmstat(8) utility prints a system-wide summary of virtual memory statistics\n    and more, based on kernel counters in the /proc file system. This example vmstat(8) output is\n    from a 48-CPU production API server:\n\n$ vmstat 1 5\nprocs -----------memory---------- ---swap-- -----io---- -system-- ------cpu-----\n    r   b  swpd      free   buff   cache     si   so     bi    bo     in          cs us sy id wa st\n    19  0     0  6531592    42656  1672040      0     0     1      7  21    33  51        4 46  0   0\n    26  0     0  6533412    42656  1672064      0     0     0      0  81262 188942        54 4 43   0   0\n    62  0     0  6533856    42656  1672088      0     0     0      8  80865 180514        53 4 43   0   0\n    34  0     0  6532972    42656  1672088      0     0     0      0  81250 180651        53 4 43   0   0\n    31  0     0  6534876    42656  1672088      0     0     0      0  74389 168210        46 3 51   0   0\n\n    This shows a system-wide CPU utilization of around 57% (cpu us + sy columns). The columns are\n    explained in detail in Chapters 6 and 7.\n\n    A metric is a statistic that has been selected to evaluate or monitor a target. Most companies use\n    monitoring agents to record selected statistics (metrics) at regular intervals, and chart them in a\n    graphical interface to see changes over time. Monitoring software can also support creating cus-\n    tom alerts from these metrics, such as sending emails to notify staff when problems are detected.\n\n    This hierarchy from counters to alerts is depicted in Figure 1.4. Figure 1.4 is provided as a guide\n    to help you understand these terms, but their use in the industry is not rigid. The terms counters,\n    statistics, and metrics are often used interchangeably. Also, alerts may be generated by any layer,\n    and not just a dedicated alerting system.\n\n    As an example of graphing metrics, Figure 1.5 is a screenshot of a Grafana-based tool observing\n    the same server as the earlier vmstat(8) output.\n\n    These line graphs are useful for capacity planning, helping you predict when resources will\n    become exhausted.\n\n    Your interpretation of performance statistics will improve with an understanding of how they\n    are calculated. Statistics, including averages, distributions, modes, and outliers, are summarized\n    in Chapter 2, Methodologies, Section 2.8, Statistics.\n\n[page 48]\n1.7 Observability 9\n\n\n\n\n\n\n\n\n\n\n    Figure 1.4 Performance instrumentation terminology\n\n\n\n\n\n\n\n\n\n\nFigure 1.5 System metrics GUI (Grafana)\n\nSometimes, time-series metrics are all that is needed to resolve a performance issue. Knowing the\nexact time a problem began may correlate with a known software or configuration change, which can\nbe reverted. Other times, metrics only point in a direction, suggesting that there is a CPU or disk issue,\nbut without explaining why. Profiling or tracing tools are necessary to dig deeper and find the cause.\n\n[page 49]\n10 Chapter 1}}Introduction\n\n       1.7.2 Profiling\n       In systems performance, the term profiling usually refers to the use of tools that perform sam-\n       pling: taking a subset (a sample) of measurements to paint a coarse picture of the target. CPUs\n       are a common profiling target. The commonly used method to profile CPUs involves taking\n       timed-interval samples of the on-CPU code paths.\n\n       An effective visualization of CPU profiles is flame graphs. CPU flame graphs can help you find\n       more performance wins than any other tool, after metrics. They reveal not only CPU issues,\n       but other types of issues as well, found by the CPU footprints they leave behind. Issues of lock\n       contention can be found by looking for CPU time in spin paths; memory issues can be analyzed\n       by finding excessive CPU time in memory allocation functions (malloc()), along with the code\n       paths that led to them; performance issues involving misconfigured networking may be discov-\n       ered by seeing CPU time in slow or legacy codepaths; and so on.\n\n       Figure 1.6 is an example CPU flame graph showing the CPU cycles spent by the iperf(1) network\n       micro-benchmark tool.\n\n\n\n\n\n\n\n\n\n\n    Figure 1.6 CPU profiling using flame graphs",
  "title": "Systems Performance \u2014 chapter 1 introduction pages 47-49",
  "token_estimate": 1015
}
