{
  "chunk_id": "systems-performance-chapter-2-methodologies-continuation-chunk-0032",
  "content_hash": "abf9c1fb4fd5b45da9dfa3e955c4de90527e0935534d5329865a1c61f15a6577",
  "next_chunk_id": "systems-performance-chapter-2-methodologies-continuation-chunk-0033",
  "page_end": 117,
  "page_start": 115,
  "prev_chunk_id": "systems-performance-chapter-2-methodologies-continuation-chunk-0031",
  "processed_id": "systems-performance-processed-001",
  "raw_id": "systems-performance-raw-001",
  "review_status": "unreviewed",
  "source_id": "systems-performance",
  "text": "[page 115]\n76   Chapter 2}}Methodologies\n\n         2.8.4 Coefficient of Variation\n         Since standard deviation is relative to the mean, variance can be understood only when consid-\n         ering both standard deviation and mean. A standard deviation of 50 alone tells us little. That\n         plus a mean of 200 tells us a lot.\n\n         There is a way to express variation as a single metric: the ratio of the standard deviation to the\n         mean, which is called the coefficient of variation (CoV or CV). For this example, the CV is 25%.\n         Lower CVs mean less variance.\n\n         Another expression of variance as a single metric is the z value, which is how many standard\n         deviations a value is from the mean.\n\n\n2.8.5 Multimodal Distributions\nThere is a problem with means, standard deviations, and percentiles, which may be obvious\nfrom the previous chart: they are intended for normal-like or unimodal distributions. System\nperformance is often bimodal, returning low latencies for a fast code path and high latencies for\na slow one, or low latencies for cache hits and high latencies for cache misses. There may also be\nmore than two modes.\n\nFigure 2.23 shows the distribution of disk I/O latency for a mixed workload of reads and writes,\nwhich includes random and sequential I/O.\n\n\n\n\n\n\n\n\n\n\nFigure 2.23 Latency distribution\n\nThis is presented as a histogram, which shows two modes. The mode on the left shows laten-\ncies of less than 1 ms, which is for on-disk cache hits. The right, with a peak around 7 ms, is for\n\n[page 116]\n2.9 Monitoring 77\n\n\non-disk cache misses: random reads. The average (mean) I/O latency is 3.3 ms, which is plotted\nas a vertical line. This average is not the index of central tendency (as described earlier); in fact, it\nis almost the opposite. As a metric, the average for this distribution is seriously misleading.\n\n     Then there was the man who drowned crossing a stream with an average depth of\n     six inches. \u2014W. I. E. Gates\n\nEvery time you see an average used as a performance metric, especially an average latency, ask:\nWhat is the distribution? Section 2.10, Visualizations, provides another example and shows how\neffective different visualizations and metrics are at showing this distribution.\n\n\n2.8.6 Outliers\nAnother statistical problem is the presence of outliers: a very small number of extremely high or\nlow values that don\u2019t appear to fit the expected distribution (single- or multimode).\n\nDisk I/O latency outliers are an example\u2014very occasional disk I/O that can take over 1,000 ms,\nwhen the majority of disk I/O is between 0 and 10 ms. Latency outliers like these can cause\nserious performance problems, but their presence can be difficult to identify from most metric\ntypes, other than as a maximum. Another example is network I/O latency outliers caused by\nTCP timer-based retransmits.\n\nFor a normal distribution, the presence of outliers is likely to shift the mean by a little, but not\nthe median (which may be useful to consider). The standard deviation and 99th percentile have\na better chance of identifying outliers, but this is still dependent on their frequency.\n\nTo better understand multimodal distributions, outliers, and other complex yet common\nbehaviors, inspect the full distribution, for example by using a histogram. See Section 2.10,\nVisualizations, for more ways to do this.\n\n\n2.9 Monitoring\n\nSystem performance monitoring records performance statistics over time (a time series) so that\nthe past can be compared to the present and time-based usage patterns can be identified. This is\nuseful for capacity planning, quantifying growth, and showing peak usage. Historic values can\nalso provide context for understanding the current value of performance metrics, by showing\nwhat the \u201cnormal\u201d range and average have been in the past.\n\n\n2.9.1 Time-Based Patterns\nExamples of time-based patterns are shown in Figures 2.24, 2.25, and 2.26, which plot file sys-\ntem reads from a cloud computing server over different time intervals.\n\n[page 117]\n78 Chapter 2}}Methodologies\n\n\n\n\n\n\n\n\n\n\n       Figure 2.24 Monitoring activity: one day\n\n\n\n\n\n\n\n\n\n\n       Figure 2.25 Monitoring activity: five days\n\n\n\n\n\n\n\n\n\n\nFigure 2.26 Monitoring activity: 30 days\n\nThese graphs show a daily pattern that begins to ramp up around 8 a.m., dips a little in the after-\nnoon, and then decays during the night. The longer-scale charts show that activity is lower on\nthe weekend days. A couple of short spikes are also visible in the 30-day chart.\n\nVarious cycles of behavior including those shown in the figures can commonly be seen in his-\ntoric data, including:\n\n    \u25a0 Hourly: Activity may occur every hour from the application environment, such as\n      monitoring and reporting tasks. It\u2019s also common for these to execute with a 5- or 10-\n      minute cycle.\n\n    \u25a0 Daily: There may be a daily pattern of usage that coincides with work hours (9 a.m. to\n      5 p.m.), which may be stretched if the server is for multiple time zones. For Internet\n      servers, the pattern may follow when worldwide users are active. Other daily activity\n      may include nightly log rotation and backups.",
  "title": "Systems Performance \u2014 chapter 2 methodologies continuation pages 115-117",
  "token_estimate": 1081
}
