{
  "chunk_id": "systems-performance-chapter-1-case-studies-and-references-chunk-0008",
  "content_hash": "5ddbc6de07e91d9de64428a8cbb144bb48c5d6bd4a6a9f9dc9f6602a84ad772f",
  "next_chunk_id": "systems-performance-chapter-1-case-studies-and-references-chunk-0009",
  "page_end": 57,
  "page_start": 56,
  "prev_chunk_id": "systems-performance-chapter-1-introduction-chunk-0007",
  "processed_id": "systems-performance-processed-001",
  "raw_id": "systems-performance-raw-001",
  "review_status": "unreviewed",
  "source_id": "systems-performance",
  "text": "[page 56]\n1.11 Case Studies 17\n\n\nHe checks disk error counters from /sys; they are zero. He runs iostat(1) with an interval of one\nsecond and watches utilization and saturation metrics over time. AcmeMon reported 80%\nutilization but uses a one-minute interval. At one-second granularity, Sumit can see that disk\nutilization fluctuates, often hitting 100% and causing levels of saturation and increased disk\nI/O latency.\n\nTo further confirm that this is blocking the database\u2014and isn\u2019t asynchronous with respect to\nthe database queries\u2014he uses a BCC/BPF tracing tool called offcputime(8) to capture stack traces\nwhenever the database was descheduled by the kernel, along with the time spent off-CPU. The\nstack traces show that the database is often blocking during a file system read, during a query.\nThis is enough evidence for Sumit.\n\nThe next question is why. The disk performance statistics appear to be consistent with high load.\nSumit performs workload characterization to understand this further, using iostat(1) to measure\nIOPS, throughput, average disk I/O latency, and the read/write ratio. For more details, Sumit can\nuse disk I/O tracing; however, he is satisfied that this already points to a case of high disk load,\nand not a problem with the disks.\n\nSumit adds more details to the ticket, stating what he checked and including screenshots of the\ncommands used to study the disks. His summary so far is that the disks are under high load,\nwhich increases I/O latency and is slowing the queries. However, the disks appear to be acting\nnormally for the load. He asks if there is a simple explanation: did the database load increase?\n\nThe database team responds that it did not, and that the rate of queries (which isn\u2019t reported by\nAcmeMon) has been steady. This sounds consistent with an earlier finding, that CPU utilization\nwas also steady.\n\nSumit thinks about what else could cause higher disk I/O load without a noticeable increase in\nCPU and has a quick talk with his colleagues about it. One of them suggests file system fragmen-\ntation, which is expected when the file system approaches 100% capacity. Sumit finds that it is\nonly at 30%.\n\nSumit knows he can perform drill-down analysis7 to understand the exact causes of disk I/O,\nbut this can be time-consuming. He tries to think of other easy explanations that he can check\nquickly first, based on his knowledge of the kernel I/O stack. He remembers that this disk I/O is\nlargely caused by file system cache (page cache) misses.\n\nSumit checks the file system cache hit ratio using cachestat(8)8 and finds it is currently at 91%.\nThis sounds high (good), but he has no historical data to compare it to. He logs in to other data-\nbase servers that serve similar workloads and finds their cache hit ratio to be over 98%. He also\nfinds that the file system cache size is much larger on the other servers.\n\nTurning his attention to the file system cache size and server memory usage, he finds something\nthat had been overlooked: a development project has a prototype application that is consuming\na growing amount of memory, even though it isn\u2019t under production load yet. This memory is\ntaken from what is available for the file system cache, reducing its hit rate and causing more file\nsystem reads to become disk reads.\n\n\n    7 This is covered in Chapter 2, Methodologies, Section 2.5.12, Drill-Down Analysis.\n    8 A BCC tracing tool covered in Chapter 8, File Systems, Section 8.6.12, cachestat.\n\n[page 57]\n18 Chapter 1}}Introduction\n\n\nSumit contacts the application development team and asks them to shut down the applica-\ntion and move it to a different server, referring to the database issue. After they do this, Sumit\nwatches disk utilization creep downward in AcmeMon as the file system cache recovers to its\noriginal size. The slow queries return to zero, and he closes the ticket as resolved.\n\n\n1.11.2 Software Change\nPamela is a performance and scalability engineer at a small company where she works on all\nperformance-related activities. The application developers have developed a new core feature\nand are unsure whether its introduction could hurt performance. Pamela decides to perform\nnon-regression testing9 of the new application version, before it is deployed in production.\n\nPamela acquires an idle server for the purpose of testing and searches for a client workload simu-\nlator. The application team had written one a while ago, although it has various limitations and\nknown bugs. She decides to try it but wants to confirm that it adequately resembles the current\nproduction workload.\n\nShe configures the server to match the current deployment configuration and runs the client\nworkload simulator from a different system to the server. The client workload can be character-\nized by studying an access log, and there is already a company tool to do this, which she uses.\nShe also runs the tool on a production server log for different times of day and compares work-\nloads. It appears that the client simulator applies an average production workload but doesn\u2019t\naccount for variance. She notes this and continues her analysis.\n\nPamela knows a number of approaches to use at this point. She picks the easiest: increasing load\nfrom the client simulator until a limit is reached (this is sometimes called stress testing). The cli-\nent simulator can be configured to execute a target number of client requests per second, with a\ndefault of 1,000 that she had used earlier. She decides to increase load starting at 100 and adding\nincrements of 100 until a limit is reached, each level being tested for one minute. She writes a\nshell script to perform the test, which collects results in a file for plotting by other tools.\n\nWith the load running, she performs active benchmarking to determine what the limiting\nfactors are. The server resources and server threads seem largely idle. The client simulator shows\nthat the request throughput levels off at around 700 per second.\n\nShe switches to the new software version and repeats the test. This also reaches the 700 mark\nand levels off. She also analyzes the server to look for limiting factors but again cannot see any.\n\nShe plots the results, showing completed request rate versus load, to visually identify the scal-\nability profile. Both appear to reach an abrupt ceiling.\n\nWhile it appears that the software versions have similar performance characteristics, Pamela is\ndisappointed that she wasn\u2019t able to identify the limiting factor causing the scalability ceiling.\nShe knows she checked only server resources, and the limiter could instead be an application\nlogic issue. It could also be elsewhere: the network or the client simulator.\n\n\n\n\n    9 Some call it regression testing, but it is an activity intended to confirm that a software or hardware change does\n    not cause performance to regress, hence, non-regression testing.",
  "title": "Systems Performance \u2014 chapter 1 case studies and references pages 56-57",
  "token_estimate": 1497
}
